"cat","item","desc","link","issue"
"techniques","Introduction to Apache Spark","Spark is currently the most popular and fastest growing Apache project. It's advertised to be lightning fast and because it avoids disk I/O and can keep everything in memory, is especially well suited to iterative algorithms like those used in machine learning. This is a good overview of what you can do with Spark and it's core libraries.","http://cur.at/tyLymFv?m=web","28"
"techniques","The data science ecosystem","Great article that explores the massive landscape of tools that are available to data scientists.  At a high-level, these are organized by where they are in the workflow: getting data, wrangling data and analyzing data.","http://cur.at/Q11AeJu?m=web","28"
"techniques","Three Things About Data Science You Won't Find In the Books","Books are great for learning theory but a lot can go wrong in practice.  Here are the three key things that the books won't tell you.","http://cur.at/JLpHs1F?m=web","28"
"resources","Awesome Machine Learning","Curated collection of machine learning frameworks, libraries and software.  This collection is maintained by Joseph Misiti on Github where it's been forked 900 times and has over 5000 stars!  This looks pretty complete but if you have a favorite that isn't on the list already, let him know.","http://cur.at/FJoYpq?m=web","28"
"resources","Deep Mind - Publications","Google's Deep Mind is working at the cutting edge of general‑purpose learning algorithms.  This collection of publications describes what they're doing there.","http://cur.at/RbiFZKk?m=web","28"
"viz","D3.js Resources to Level Up","D3 is one of the most important libraries for enabling interactive data visualizations on the web.  This is a well-organized and comprehensive collection of resources for learning and mastering D3.  To get an idea of what D3 is capable of, check out Mike Bostock's ","http://cur.at/DtfpdPl?m=web","28"
"news","Learning to See Data","Scientists working in a little-known branch of psychology called ","http://cur.at/vqOwped?m=web","29"
"techniques","What to Do When People Draw Different Conclusions From the Same Data","Researchers recruited 61 analysts and asked them specific questions about the same set of data.  What happened next suggests some worthwhile approaches for both small and large teams.","http://cur.at/6Aemfq2?m=web","29"
"techniques","The Data Science Ecosystem Part 2: Data wrangling","Continuation of a three part series that explores the massive landscape of tools that are available to data scientists.  This week's focus: Data Wrangling - the necessary dirty work that's said to take up to 80% of data scientists' time.","http://cur.at/x2u0Jp?m=web","29"
"techniques","Breaking Linear Classifiers on ImageNet","A number of researchers have recently shown that Convolutional Networks can be easily fooled. This article is a good discussion of what's really going on and offers suggestions for moving forward.","http://cur.at/D8TPIrN?m=web","29"
"techniques","Modern Methods for Sentiment Analysis","Sentiment analysis is a type of Natural Language Processing that extracts subjective information, such as emotion, from text.  This tutorial by District Data Labs provides a great overview of current strategies and how to work with two commonly used libraries: Word2Vec and Doc2Vec.  Highly recommended.","http://cur.at/SwKs8VX?m=web","29"
"techniques","Map and Analyze Raster Data in R","Much of the analysis that used to be done with a traditional GIS can now be done in R.  This is a good tutorial for getting started, using the raster and rasterVis packages by Oscar Perpiñán.","http://cur.at/5Kr5lBA?m=web","29"
"resources","An Introduction to Statistics using Python","This is a well-organized and comprehensive introduction to doing statistical analysis with Python.  It's clearly written and includes lots of sample code and screenshots.  Definitely worth bookmarking.","http://cur.at/tdLeqKu?m=web","29"
"viz","Cheatsheet for Data Visualization with ggplot2","Nice cheatsheet for data visualization with ggplot2 (pdf).","http://cur.at/wjkZbap?m=web","29"
"viz","Design and Redesign in Data Visualization","Thoughtful essay by Fernanda Viégas and Martin Wattenberg regarding data visualization design and the importance of critique.  I like articles that make me think and I found myself coming back to this one a few times this week.  It begins with Edward Tufte's redesign of the charts that were used in the decision process that led to the explosion of the Space Shuttle Challenger in 1987.  Several great examples follow and the essay concludes with suggested ""Rules of Engagement.""","http://cur.at/GuRxLzS?m=web","29"
"news","If Algorithms Know All, How Much Should Humans Help?","More and more, decisions are made by algorithms that have been carefully crafted to act on their own.  It's one thing when the algorithms are optimizing ads but what about when they're making decisions regarding things like loan approvals, crime prevention, and medical diagnoses?  Interesting read.","http://cur.at/kqIVoKR?m=web","30"
"news","Everything We Wish We'd Known About Building Data Products","DJ Patil and Ruslan Belkin recently kicked off First Round's CTO Summit and offered their most salient lessons-learned related to building and launching data products.  This is a fantastic recap, including a well-reasoned, pre-launch checklist.  Regardless of the domain you're working in, if you're working with data, this is a MUST READ.","http://cur.at/bE8naKq?m=web","30"
"news","Amazon Machine Learning – Make Data-Driven Decisions at Scale","Amazon just announced a new AWS service for machine learning that will let users make real-time predictions at scale.  It looks fairly capable and apparently, is designed for users that aren't necessarily machine learning experts.  This post in Amazon's AWS blog offers a good overview of what you can do with this new service and how to get started.","http://cur.at/xZVHTSN?m=web","30"
"techniques","Boltons: over 100 Python utilities","Nice collection of Python utilities that are conspicuously missing from the standard library.  This collection is very well documented and is gaining traction quickly.  Highly recommended.","http://cur.at/bEEG7kJ?m=web","30"
"techniques","New Video Series: Intro to Machine Learning with scikit-learn","If you're interested in learning how to use Python for machine learning, this looks like a great place to start.  Kevin Markham is hosting a video series about Python's scikit-learn on Kaggle's ","http://cur.at/9pkIuH0?m=web","30"
"resources","An Introduction to Statistical Learning","Free download of the popular and highly regarded ","http://cur.at/nfLtI0N?m=web","30"
"viz","The colors of paintings: Blue is the new orange","This visualization by Martin Bellander caused quite a stir on the social networks this week. It's based on 94,526 paintings and shows a clear trend towards blue over the past 100 years.  This is a great post that details his data extraction and analysis process using R.","http://cur.at/jGKoOlb?m=web","30"
"viz","Making Complex Heatmaps","The ComplexHeatmap package (R) provides a flexible way to arrange multiple heatmaps while supporting self-defined annotation graphics.  This is a good writeup of its features and how to work with it.","http://cur.at/kZTGrdu?m=web","30"
"viz","Gestalt Principles for Data Visualization","Interesting series by Elijah Meeks.  There's a lot to think about here and the series is very well organized and presented.  Highly recommended.","No link present","30"
"news","Reddit ""Ask Me Anything"" with Andrew Ng and Adam Coates","If you're interested in machine learning, you'll definitely want to check this out.  At over 360 upvotes, this is one of the most popular Machine Learning posts on Reddit in quite awhile.  There are lots of insights here regarding industry trends, career paths, and implementations.","http://cur.at/9nZCKv1?m=web","31"
"news","Customer Data: Designing for Transparency and Trust","How much do people around the world think their data is worth? If your business depends on access to user data, this is an important question since consumers are becoming increasingly savvy about how their data is used.  This in-depth article dives into ways to provide value for users' data while building trust along the way.","http://cur.at/3g7LpEX?m=web","31"
"news","8 Possible Alternatives To The Turing Test","I'm not sure that detecting ""human-like"" intelligence really gets at the heart of the matter but that ","http://cur.at/j0CIvT6?m=web","31"
"techniques","Conferences","There were a couple of great conferences this past week that are worth noting. OpenVis is definitely one of the best data visualization conferences ","No link present","31"
"techniques","The data science ecosystem, part 3: Data applications","The final installment of a three part series that explores the massive landscape of tools that are available to data scientists. This week's focus: Data Applications - where the ""sexy stuff"" like predictive analysis, data mining and machine learning happen. This is the part where you take all your data and do something really amazing with it...","http://cur.at/JbUt99p?m=web","31"
"resources","Open Terrain","Here's a growing resource that's worth paying attention to.  Stamen Design is collecting the best freely-available terrain datasets for the ","http://cur.at/fPq2Lbu?m=web","31"
"resources","Awesome Public Datasets","Nice collection of public datasets on GitHub.  There are currently 271 datasets listed, covering a broad range of domains.  This collection is well organized, has been starred 2300 times and it looks like it's regularly updated.","http://cur.at/Sq8kI7f?m=web","31"
"news","Data Is the New Middle Manager","Startups are keeping head counts low, and even eliminating management positions, by replacing decision-makers with data. Here's how that's going.","http://cur.at/1ayIaP7?m=web","32"
"news","Bloomberg to Give $42 Million to Help Cities do More with Data","Bloomberg Philanthropies announced this week that it is investing $42 million to create the ","http://cur.at/yLdYdTw?m=web","32"
"news","Probabilistic Programming Does in 50 lines of Code What Used to Take Thousands","In 2013, the U.S. Defense Advanced Research Projects Agency (DARPA) launched a four-year program to fund research in ","http://cur.at/vDk3urr?m=web","32"
"news","Fei-Fei Li: If We Want Machines to Think, We Need to Teach Them to See","Great article in ","http://cur.at/Zic76Tu?m=web","32"
"techniques","Selected Tools","Fantastic collection of 55 useful tools for data visualization.  This collection is curated by the folks at Datavisualization.ch and is well-organized and easy to search.  Highly Recommended.","http://cur.at/n7ejHTG?m=web","32"
"techniques","Crowd-Sourced Stock Sentiment Using StockTwits","StockTwits is a Twitter-like service that allows users to post news, ideas, and questions about individual stocks.  It also supports ","http://cur.at/HUJmzPL?m=web","32"
"techniques","Markup for Fast Data Science Publication","Nice overview of markup languages that make it fast and easy to include documentation with your projects.  Whether you want to create HTML, ePub, Mobi, PDF, Python documentation, or even interactive code, you'll find an option here to streamline your workflow.  This is well-written and includes lots of examples and links to references.","http://cur.at/8IgpmgR?m=web","32"
"resources","The Only Probability Cheatsheet You'll Ever Need","This 8-page PDF includes a comprehensive suite of notes summarizing important probability concepts, formulas, and distributions, with examples, stories, and solved problems.","http://cur.at/I4ov4Mz?m=web","32"
"resources","Free GIS Data","Robin Wilson from the University of Southampton maintains this list of freely available geographic datasets.  There are over 300 sites listed here that cover an amazing breadth of categories including things like elevation, weather, climate, natural disasters, ecology, wars, population, points of interest, roads, and government data from throughout the world.  This is definitely worth bookmarking.","http://cur.at/38BmuMP?m=web","32"
"resources","The 7 Best Data Science and Machine Learning Podcasts","This collection of data science and machine learning podcasts generated a lot of interest around the web this week.  This list includes a couple of podcasts I hadn't heard of and is a solid list with good descriptions and links to each.","http://cur.at/LFlkaG5?m=web","32"
"news","How Data is Saving Lives in Nepal","This was, unfortunately, a BIG week for Nepal. Recovery efforts are continuing in the aftermath of the 7.8-magnitude earthquake on April 25th and may go on for months.  At least initially after a big disaster like this, one of the most important resources for saving lives and planning recovery efforts is data.  Data needs to be acquired, analyzed, and then disseminated to rescuers and planners.  Here are two great articles that describe some of the most important data-related activities this week:","No link present","33"
"news","Statistics: P values are just the tip of the iceberg"," say Jeffrey T. Leek and Roger D. Peng.  This is a worthwhile read that generated a lot of ","http://cur.at/gK0iSCz?m=web","33"
"news","Deep Learning Machine Solves the Cocktail Party Problem","Separating a singer’s voice from background music has always been a uniquely human ability. Not anymore.  Here's a good overview of how researchers accomplished this feat. If you're interested in the details, check out the link at the end.","http://cur.at/SqMHSoG?m=web","33"
"news","The Talent Dividend","The 2015 Data & Analytics Report by ","http://cur.at/x2zWGdb?m=web","33"
"techniques","Markov Composer - Using machine learning and a Markov chain to compose music","If you have any interest in computer generated music, here's a fun experiment using Markov chains.  There's a Git repo that goes along with the article and a good discussion in ","http://cur.at/t4USeRv?m=web","33"
"techniques","How Old do I Look?  Fun with Machine Learning, Stream Analytics and PowerBI","A couple of machine learning engineers were playing with Microsoft’s newly released Face detection API and created a page at ","http://cur.at/1kAgoN4?m=web","33"
"resources","Best Data Science talks from PyCon Montreal 2015","Nice collection of data science Python presentations from the recent PyCon conference in Montreal. There are a variety of topics here, including ways to handle messy data, interactive data for the web, machine learning, Docker, real-time streaming, and graph databases. These are each about a half hour and are loosely ordered from beginner to expert.","http://cur.at/l34vM4v?m=web","33"
"resources","Awesome R","Here's another resource that's well-suited for the ","http://cur.at/xzqNBvz?m=web","33"
"news","The Computers Are Listening - How The NSA Converts Spoken Words Into Searchable Text","  This isn't a technical read but is a good run-down of the progress and challenges facing the intelligence community.","http://cur.at/IrwF5x0?m=web","34"
"news","How Not to Drown in Numbers","  This is an insightful article by two data scientists, one from Facebook and one from Google, about how to find meaning in the never-ending deluge of big data.  This is short and very worthwhile.","http://cur.at/18uniZb?m=web","34"
"news","Artificial Intelligence is the Next Big Thing for Hedge Funds Seeking an Edge","Computer-assisted trading is nothing new but machine learning is radically changing the game.  Here's how that's going.","http://cur.at/JmvceYf?m=web","34"
"news","Courts Docs Show How Google Slices Users Into “Millions Of Buckets”","Google watches most everything you do and say online.  It reads your email, peers over your shoulder while you browse, knows what you watch on YouTube, and — by tracking your devices — even knows where you are at this very moment. And that's just the beginning. By using advanced statistics and data mining techniques, Google knows far more about you than you likely ever imagined.  Fascinating read.","http://cur.at/Ywiox43?m=web","34"
"techniques","Rendering Notebooks on GitHub","Jupyter/IPython notebook (.ipynb) now render directly on GitHub.  These notebooks make it easy to capture data-driven workflows that combine code, equations, text and visualizations and share them with others.  Having them render directly on GitHub is huge.","http://cur.at/QsaWCht?m=web","34"
"techniques","Emojineering - Discovering The Hidden Semantics Of Emoji","👍😍The Instagram Engineering team posted two great articles this week about how they handle Emoji characters.  These are great posts that describe how Instagram uses machine learning and natural language processing to discover the hidden meanings in this relatively new, visual language. Even if you don't think you're interested in machine learning, these are MUST READS!  Really well-written at an easy-to-understand level:","No link present","34"
"techniques","Large-Scale Social Phenomena - Data Mining Demo","Great text data mining tutorial contained in a set of IPython notebooks.  This is self-contained with data and is very well-documented.  It demonstrates the basic functionality of several libraries, including Numpy, Scipy, Matplotlib, Scikit-learn, Pandas, Networkx, and NLTK. Fun little evening project.","http://cur.at/XQ7bUGS?m=web","34"
"techniques","Predicting a Billboard Music Hit with Shazam Data","Fascinating 10 minute presentation about insights that Shazam derives from its users' data.  Highly recommended.","http://cur.at/exO0Jpk?m=web","34"
"techniques","Clusterize.js","Nice, small, JavaScript library that makes it easy to display large datasets.  This was just recently released and has 2300 stars already on GitHub.  It's well documented and includes lots of examples.","http://cur.at/hXwkzPZ?m=web","34"
"resources","NASA's Data Portal","NASA's data portal includes thousands of datasets, has well-documented APIs, and is easily searchable.  If you're interested in the sciences, this is a highly recommended resource.","http://cur.at/M6ZI2dk?m=web","34"
"resources","Automate the Boring Stuff with Python ","This is a free HTML version of a new Python book that's been getting rave reviews.  It's billed as a guide to ""practical programming for total beginners"" so you won't find things like Numpy and Scipy here but you will find practical stuff like web scraping, parsing PDFs and Word docs, updating spreadsheets, working with email, scheduling tasks, pattern matching, and manipulating images.","http://cur.at/DxhSv3K?m=web","34"
"viz","What Killed The Infographic?","  This is a super interesting article that has generated quite a buzz around the web this week. There's some great viz work here too.  This is a MUST READ for everyone interested in the field of data visualization and where it's going.","http://cur.at/imO38DR?m=web","34"
"viz","Best Of The Visualisation Web","And for insights into how the above article translates to the real world, check out this monthly roundup by Andy Kirk of the best data visualization work around the web.  There's a lot here to learn from and be inspired by. Highly recommended.","http://cur.at/sSxXnfU?m=web","34"
"viz","To the Point: 7 Reasons You Should Use Dot Graphs","Points go beyond where lines and bar graphs stop.  Here are 7 good reasons to consider using points instead of lines.","http://cur.at/fGzD8lq?m=web","34"
"news","How Data Nerds Found A 131-Year-Old Sunken Treasure","The SS Central America, a steamer carrying a ","http://cur.at/ajSIBqd?m=web","35"
"news","The Machine Vision Algorithm Beating Art Historians at Their Own Game","Classifying a painting by artist and style is tricky for humans; spotting the links between different artists and styles is harder still. So it should be impossible for machines... right?","http://cur.at/e010AaK?m=web","35"
"techniques","R vs Python for Data Analysis","This infographic that pits R against Python has gotten a lot of attention around the web this week.  There's a lot of worthwhile information here and it's super easy to follow the presentation.  This is a great contribution to the R vs Python debate.  Highly recommended.","http://cur.at/S5G77Fy?m=web","35"
"techniques","Software development skills for data scientists","Data scientists typically don't have much, if any, formal computer science or software development experience.  That may be fine for solo analysis work but can lead to problems when trying to collaborate.  This is a great run-down by Trey Causey of what data scientists ","http://cur.at/xFTEhNj?m=web","35"
"techniques","scikit-neuralnetwork","Deep neural network implementation without the learning cliff! This library implements multi-layer perceptrons as a wrapper for the powerful pylearn2 library that's compatible with scikit-learn for a more user-friendly and Pythonic interface. Includes automated tests, benchmarks, a visualization, examples, and good documentation.  This has gotten a lot of attention quickly.","http://cur.at/HoYdImJ?m=web","35"
"resources","Great R Packages for Data Import, Wrangling & Visualization","Great curation of useful R packages, including descriptions, sample commands and links to tutorials and GitHub repos.  This is a great resource for R users.","http://cur.at/8acOY1c?m=web","35"
"resources","Stanford Machine Learning Notes","Andrew Ng's Machine Learning MOOC is an infamous introduction to the topic.  Here's a fantastic set of notes to go along with the course by a PhD student named Alex Holehouse.  If you've been interested in taking the course but haven't been able to fit it into your schedule, now's a great time to think about it.  Along with help from Alex's notes, ","http://cur.at/yOC3TJu?m=web","35"
"viz","From Paint to Pixels - How Data Became a New Medium for Artists","This is an interesting look at an evolving and rapidly growing trend in the art world.  Data is the new medium and along with enabling an innate desire of self-expression, artists are helping scientists see their research from new angles.  Great read, with lots of linked references.","http://cur.at/KRTugit?m=web","35"
"viz","Randy Olson - Data Visualization ""Ask Me Anything"" (AMA)","Along with being an AI researcher at the University of Pennsylvania, Randy Olson leads the largest online community dedicated to data visualization on Reddit, /r/DataIsBeautiful, which serves over 2,000,000 unique monthly visitors.  This isn't a long AMA, but there are some great answers here, which has inspired over 8600 views so far.  You'll find tips for getting started with data viz, common mistakes to avoid, and lots of worthwhile links.","http://cur.at/WDKGFyO?m=web","35"
"viz","D3 Financial Components","Anyone interested in market analysis will definitely want to check out this new D3 library.  Components include Bollinger bands, candlestick series, moving averages, sparklines, relative strength indicators, etc, etc.  This is well documented with examples.  It's great to see libraries like this being built with D3.  This is super useful!","http://cur.at/2qceZy0?m=web","35"
"news","Health and Data: Can Digital Fitness Monitors Revolutionize Our Lives?","Wearable devices have enabled people to track their activities and health stats in ever-increasing levels of detail.  This is a great overview of how useful that is, some very interesting upcoming technologies, and things we should all be concerned about.  Highly recommended.","http://cur.at/ka9EGxk?m=web","36"
"news","Machine-Learning Algorithm Mines Rap Lyrics, Then Writes Its Own","Researchers are claiming that an automated rap-generating algorithm pushes the boundaries of machine creativity.  Here's a good overview of how it works along with sample lyrics.  How good are they?  Check it out.","http://cur.at/ZfQb73d?m=web","36"
"news","An NPR Reporter Raced A Machine To Write A News Story. Who Won?","This NPR story pits a seasoned White House correspondent against a machine.  You can probably guess who wins the race but can you tell ","http://cur.at/YJoPDCv?m=web","36"
"techniques","Scientists Tell Us How Your Old Pics Will Change Time-lapse Photography","Fascinating project.  A group of researchers at Google and the University of Washington mined 86 million photos from the Internet and automatically pieced them together to create time-lapse sequences of popular places. The video is just 5 minutes and very worthwhile.","http://cur.at/pdeV6y2?m=web","36"
"techniques","Scrape Website Data With The New R Package rvest","Great tutorial by Zev Ross for extracting data from website tables and lists using the R package, rvest.  This is well-written with code snippets to make it easy to follow.  Along with demonstrating rvest, the tutorial includes steps to geocode and map the extracted demo data.","http://cur.at/2UhthGi?m=web","36"
"techniques","Top 10 Data Mining Algorithms in Plain English","This is a great introduction to popular data mining algorithms.  Each section includes a description of the algorithm, related terms, common use cases, and linked references.  If you're not already a data mining pro, this article is Highly Recommended.","http://cur.at/LhsdYx0?m=web","36"
"techniques","The Unreasonable Effectiveness of Recurrent Neural Networks","Here's the latest gem by Andrej Karpathy. This is a clearly presented deep dive into recurrent neural networks with a GitHub repo of code to go along with the article.  There's also a ","http://cur.at/BnN15HT?m=web","36"
