"cat","item","desc","link","issue"
"resources","Data Driven Journalism Course ","Free online data journalism course comprised of video lectures, tutorials, assignments, readings and discussion forums.  Video lectures by industry leaders anchor each of five modules.  This had been expected to close last month but was recently extended due to high demand.  Now available through March 31.","http://cur.at/wOKz2Uo?m=web","18"
"viz","6000 Moons: An Experimental Data Visualization in VR","Interesting immersive data experiment using virtual reality goggles.  Even if you don't have VR goggles, this is worth checking out since this is surely a preview of things to come for data visualization.","http://cur.at/mFFq4yE?m=web","18"
"viz","A Look at Arc Diagrams","Nice overview of arc diagrams, including examples and things to watch out for.","http://cur.at/g2F7gWA?m=web","18"
"news","Internet to Neural Net: Google Search Will Be Your Next Brain","Fantastic read about how artificial intelligence has defined Google over the years.  This is the third of a four-part series by Steve Levy about ""Search's quiet transformation.""  The entire series is highly recommended.","http://cur.at/N9hd8zC?m=web","19"
"news","What Do You Think About Machines That Think?","Every year Edge.org poses a different question to provoke and inspire debate. This year's question, ""What do you think about machines that think?"" has generated a fascinating mix of responses.  Among the highlights so far:","http://cur.at/zzLj6lA?m=web","19"
"news","Facebook open sources tools for bigger, faster deep learning models","Facebook recently open-sourced a handful of libraries to help developers build bigger, faster deep learning models than existing tools allow.  Here's a good overview of what the tools do, why they're important, and how to get them.","http://cur.at/VbJNsAg?m=web","19"
"techniques","A Deep Dive into Recurrent Neural Nets","Two weeks ago, Mikhil Buduma's article, ","http://cur.at/wpoxjJn?m=web","19"
"techniques","How to understand the drawbacks of K-means","Nice discussion on Cross Validated about the hidden assumptions of the k-means algorithm.","http://cur.at/CrWPDuF?m=web","19"
"techniques","Introduction to Python for Data Mining","Here's a gentle introduction to using Python for data mining.","http://cur.at/uheTlB2?m=web","19"
"resources","Data Wrangling with dplyr and tidyr","Nice cheatsheet for data wrangling with R's dplyr and tidyr packages.","http://cur.at/rXTP1m1?m=web","19"
"resources","Salary: Data Scientist","260 Data Scientists from around the U.S. have reported salary information to glassdoor.com.  Here are the details.","http://cur.at/UpJGCad?m=web","19"
"viz","Visualizing Representations: Deep Learning and Human Beings","Great article by Christopher Olah about using visualization for understanding neural nets.  Christopher worked with Google's Deep Learning Research Group and his visualization work is inspired by Brett Victor of WorryDream.  Highly recommended.","http://cur.at/Niq1VvS?m=web","19"
"viz","Make grey your best friend","It's not uncommon to think that ""good"" visualizations are somehow visually dramatic and colorful.  Here's a wiser approach, including examples and rationale.","http://cur.at/Ajlhfza?m=web","19"
"news","The Technology that Unmasks Your Hidden Emotions","Companies are amassing an enormous database of human emotions using technology that relies on psychology and data mining to analyze people’s faces.  Paul Ekman, the pioneer of this technology, fears he has created a monster.","http://cur.at/UGBM8jh?m=web","20"
"news","Microsoft buys data science specialist Revolution Analytics","Microsoft agreed this week to acquire Revolution Analytics.  For the data science community, that's a big deal.  Here's why it matters.","http://cur.at/K5YsQb1?m=web","20"
"techniques","Data Science in Python - Journey from a Python noob to a Kaggler","Interested in learning how to do data analysis with Python but not sure where to start?  Here's a comprehensive learning guide to get you going.","http://cur.at/H5rTz19?m=web","20"
"techniques","Avoiding a Common Mistake with Time Series | Silicon Valley Data Science","Just because two things appear to be related to each other doesn’t mean that one causes the other.  Trends in the data are particularly problematic.  Here's why, with suggestions on how to handle the issue.","http://cur.at/Ikz8Yf9?m=web","20"
"resources","Awesome Artificial Intelligence","Nice collection of Artificial Intelligence courses, books, video lectures and papers.  If you're interested in AI, you definitely don't want to miss this.","http://cur.at/NJoHAGz?m=web","20"
"resources","spaCy: Industrial-strength NLP","The author of spaCy, Matthew Honnibal, claims that this is the fastest Natural Language Processing (NLP) software ever released.  It's written in Python and is available under an open-source license for research.","http://cur.at/GM7oTzK?m=web","20"
"resources","Data Sources on the Web","Nice collection of data sources on the web.  Most are free and many are formatted for easy access via R.","http://cur.at/Y3zZdMD?m=web","20"
"viz","Image kernels explained visually","An image kernel is a matrix that's used to apply effects such as blurring, sharpening, outlining or embossing. Image kernels are also used in machine learning for ","http://cur.at/Kbfz0Mp?m=web","20"
"viz","Word-oriented Bookworm","This site puts one year's State of the Union in context with any other.  Select a word or two, and a frequency graph of those words is displayed according to their use by other presidents.  This is built on the ","http://cur.at/iTxuBSR?m=web","20"
"viz","Overview of Python Visualization Tools","Plotting data in Python is a good news/bad news story. The good news is that there are a lot of options. And the bad news is that there are a lot of options. Here's an overview of what those options are and when to use them.","http://cur.at/XeYugAH?m=web","20"
"news","Google Brain’s Co-Inventor Tells Why He’s Building Chinese Neural Networks","Andrew Ng is one of the leading experts in machine learning.  He's the Chief Scientist of Baidu, co-founder of Coursera, and an Associate Professor at Stanford. This interview offers his insights about challenges facing AI and ""evil killer robots.""","http://cur.at/76DUtqM?m=web","21"
"news","TeraDeep wants to bring deep learning to your dumb devices","TeraDeep is a startup that wants you to revive your old devices by giving them the power of Deep Learning.  Here's how.","http://cur.at/xN6ua7F?m=web","21"
"techniques","Here's Waldo: Computing the optimal search strategy for finding Waldo","Brilliant weekend project by Randy Olson!  Using a variety of machine learning tricks, here's how he determined the optimal search strategy for finding Waldo.","http://cur.at/RnHW4vV?m=web","21"
"techniques","Music Recognition: The Shazam Algorithm","Ever wonder how music recognition engines work? This is a great read with lots of diagrams, code snippets, and links to explore.","http://cur.at/fdjY6bk?m=web","21"
"techniques","Online Learning Perceptron","This article follows the story of a concept devised in 1943 to a Kaggle competition in 2015. It shows that a single artificial neuron can get 0.95 AUC on an NLP sentiment analysis task.  This is a nice exploration of how it works.","http://cur.at/fEZWaaT?m=web","21"
"resources","Pandas Cookbook","pandas is a Python library for doing data analysis. It's really fast and lets you do exploratory work incredibly quickly.  Here's a great cookbook by Julia Evans that's full of instructive recipes for performing common tasks.  Highly recommended.","http://cur.at/BaWf65k?m=web","21"
"resources","Notebook Gallery - Links to the best IPython and Jupyter Notebooks.","Awesome curated collection of IPython and Jupyter Notebooks.  There's a lot to explore here... neural nets, pandas, python for data mining, D3 for MatPlotlib, etc, etc, etc.  Highly recommended.","http://cur.at/bsG5MRB?m=web","21"
"resources","Abridged List of Machine Learning Topics","The title says ""Abridged"" but there's a ","http://cur.at/86W8VHI?m=web","21"
"viz","Color scales in Python for humans","Here's an easy-to-use, web-friendly color conversion and interpolation library for Python.  This is well-documented and greatly simplifies data presentation.","http://cur.at/nOtk54o?m=web","21"
"viz","After the flood | London Squared Map","This is a great overview of strategies for visualizing data that's associated with a map.  They're not all obvious!  This is well-presented with lots of diagrams.","http://cur.at/32lzk1u?m=web","21"
"news","Data Science Darling Kaggle Cuts a Third of Its Staff","Kaggle, the San Francisco startup that has spent the past five years organizing data prediction competitions, has cut about a third of its staff.  Here's what that means for the data science community.","http://cur.at/dpr8BxX?m=web","22"
"news","Here’s more evidence that sports is a goldmine for machine learning","It's no secret that there's a lot of money in sports.  And there's a lot of data too.  If you happen to be interested in both, there are a lot of opportunities for you.  This is a nice overview of recent developments in the sports analytics space.","http://cur.at/bKgN17y?m=web","22"
"techniques","Doing Naive Bayes Classification","Great tutorial by Lynn Cherny.  Using Fifty Shades of Grey as a vehicle, this tutorial goes from labeled text to machine classification - first with NLTK and then the Python machine learning library scikit-learn.  The explanations are clear, it's entertaining, and there's a repo of code to back it up.  Highly recommended.","http://cur.at/j5PSoLt?m=web","22"
"techniques","Getting Started with Spark (in Python)","If you haven't been hearing about Apache Spark yet, you will be soon.  Spark is an open-source cluster computing framework that avoids the I/O costs of Hadoop MapReduce by keeping everything in memory.  This allows users to load lots of data into a cluster's memory and query it repeatedly.  It's very fast and is especially well suited to iterative algorithms, like those used in machine learning.  This is a great tutorial to get started with Spark in Python.","http://cur.at/4w4otCY?m=web","22"
"techniques","Neural network with numpy","Gentle introduction to building a neural net with Python's numpy library - with sample code.","http://cur.at/rzvHTrB?m=web","22"
"resources","Best Time to Learn Linear Algebra is Now!","Linear Algebra is a crucial prerequisite for many things that are related to data.  If you're just starting out or want a refresher, there are some really great resources here.","http://cur.at/FabdChd?m=web","22"
"resources","Defense Advanced Research Projects Agency (DARPA): XDATA","DARPA's mission is to create breakthrough technologies for national security so it's no surprise that they're into data.  But you might be surprised to discover that they're helping to develop a substantial open-source library of ""tools and techniques to process and analyze large sets of imperfect, incomplete data.""  There's a lot to explore here...","http://cur.at/Yy6WRUR?m=web","22"
"viz","Measles is back in the US – and it's spreading. ","This story has been making headlines around the world lately.  And the response by the news industry has been consistent: create interactive data visualizations!  This is an awesome opportunity to see a variety of visual approaches that come out of digging into the same story.  All four of these are really great:","No link present","22"
"viz","References For Visualising Uncertainty","Ever wonder how to show the data you're not so sure about?  Visualizing uncertainty is a hard problem.  Andy Kirk of Visualizing Data put together this great collection of references, papers and examples to explore the issue and help you decide how to handle it in your next project.","http://cur.at/RaRlXfT?m=web","22"
"news","The White House Names Dr. DJ Patil as the First U.S. Chief Data Scientist","The White House put data science on a pedestal this week.  Not only did it name Dr. DJ Patil as the First U.S. Chief Data Scientist, Patil was introduced at this week's Strata Conference by President Obama.  It’s not entirely clear what this new position will entail but this briefing from the White House is a good rundown of what's known so far.","http://cur.at/NRQAvqM?m=web","23"
"news","Facebook AI Director Yann LeCun on His Quest to Unleash Deep Learning and Make Machines Smarter","Few people have been more closely associated with Deep Learning than Yann LeCun. LeCun has been instrumental in developing the convolutional neural network technique that promises big improvements in things like computer vision, speech recognition, and natural language processing.  Since 2013, LeCun been working as the head of Facebook's Artificial Intelligence Research Lab.  This is a great interview by Lee Gomes that covers a broad range of topics in AI and why it's important.","http://cur.at/llvLMQd?m=web","23"
"news","DNA Data Storage Just Got a Bit More Practical","Using DNA to store arbitrary data has been under investigation for the past few years.  Potentially, this approach could lead to data storage that persists for a million years or more.  At the least, this is a fascinating data archival strategy.  Here's a quick recap of recent progress and remaining issues.","http://cur.at/yMQdyx7?m=web","23"
"techniques","Go and Artificial Intelligence","Fantastic overview of Go and why Go AI is hard.  This 25 minute video is very well done.  It starts with a short history of the game and quickly gets into the rules and strategies before diving into AI challenges and approaches.  Highly recommended.","http://cur.at/CX6sXEK?m=web","23"
"techniques","RAD - Outlier Detection on Big Data","Netflix recently open-sourced their outlier detection function for big data called ","http://cur.at/6eQFSEb?m=web","23"
"resources","mlxtend - Machine Learning Library Extensions","Sebastian Raschka’s mlxtend library has a number of tools to extend Python's data analysis and machine learning libraries.  This is definitely worth checking out.","http://cur.at/QWt2Chc?m=web","23"
"viz","rbokeh - R Interface to Bokeh","Bokeh is a visualization library for creating interactive, web-based plots. Bokeh has interfaces for Python, Scala, Julia, and, as of this week, R.  This is a great tutorial for working with Bokeh’s new R interface.","http://cur.at/Nb7jNT4?m=web","23"
"viz","Bivariate Choropleth Maps: A How-to Guide","Nice language-agnostic tutorial for creating bivariate choropleth maps.  Not sure what that means?  That's where the tutorial begins.  This is very well done.","http://cur.at/VLwRWZu?m=web","23"
"news","A Memo to the American People from U.S. Chief Data Scientist Dr. DJ Patil","There's a lot of data-related inspiration coming out of the White House lately.  Last week, President Obama named Dr. DJ Patil as the first-ever U.S. Chief Data Scientist.  Don't miss these:","http://cur.at/3TRXFL3?m=web","24"
"news","Google's AI Masters Space Invaders","In a paper published in ","http://cur.at/iN20jZ8?m=web","24"
"news","Data Mining Indian Recipes Reveals New Food Pairing Phenomenon","It doesn't seem that it would be difficult to come up with a set of rules that determine how ingredients should be used together. But by treating large collections of recipes as networks, researchers have discovered some interesting anomalies.","http://cur.at/7TYnEsi?m=web","24"
"techniques","Waterfall plots in R","Waterfall plots are effectively bar charts but designed to be read left-to-right so that you can see how a series of intermediate steps leads to a final conclusion.  This is a good description of the technique and includes a link to sample code.","http://cur.at/gOTYFHj?m=web","24"
"techniques","Base R Plots","Base R plots may not be as slick as those made with ggplot but these are fast and work on just about anything.  This is a nice overview of what you can do with Base R plots and how to use them.","http://cur.at/NGum5cJ?m=web","24"
"resources","Dataset Collections","Looking for data?  Sebastian Raschka maintains this curated collection of free and open-source datasets.  Many are particularly well suited to data science research.  He's interested in expanding the list so if you have a favorite dataset that's not listed, let him know.","http://cur.at/XCfESUD?m=web","24"
"resources","Favorite Podcasts for Data Scientists","Several people have written to let me know about their favorite data podcasts.  It's true that there are some really good ones that are worth paying attention to.  With the exception of ","http://cur.at/hA56QvZ?m=web","24"
"viz","Visualizing Hold'em Hands","Beautiful set of data visualizations that compares the strength of a particular Texas hold'em hand against all other hands.  There are some surprises here but the explanations are great and may lead you to scratch your head a bit.","http://cur.at/jGIo3DZ?m=web","24"
"viz","The Future of Data Visualization","Great talk by Jeffrey Heer about trends in data visualization.  This is a worthwhile 10-minutes and if you aren't already familiar with it, be sure to check out his interactive ACM article, ","http://cur.at/nya22CA?m=web","24"
"viz","The Architecture of a Data Visualization","Half art. Half data viz.  There are some real beauties here.  This is a great article by the folks at Accurat Studio that describes their design process.  Highly recommended.","http://cur.at/AYlm1fH?m=web","24"
"news","How Madden Ratings Are Made - The Secret Process That Turns NFL Players Into Digital Gods","Fantastic story about the Madden NFL video-game franchise.  There's a bit of everything you'd want in a data science drama: algorithms, politics, data visualizations, clips from the game, and interviews with the stars. Highly recommended.","http://cur.at/K04LOl1?m=web","25"
"news","I am Jürgen Schmidhuber, AMA!","Since age 15 or so, Jürgen Schmidhuber's main scientific ambition has been to build an optimal scientist through self-improving Artificial Intelligence, then retire.  He's still working on that but in the meantime has accomplished an enormous amount.  This is a great Reddit AMA (Ask Me Anything).","http://cur.at/vOTs6fs?m=web","25"
"news","Six keys to sports analytics","The ninth annual MIT Sloan Sports Analytics Conference (SSAC) was the biggest meeting yet of sports-data experts.  One thing that's clear in this synopsis is that there's a lot of untapped opportunity in the sports analytics field.","http://cur.at/CiIFQG0?m=web","25"
"techniques","Seeing Circles, Sines, And Signals","Awesome introduction to digital signal processing. It's based on a collection of interactive visualizations, which make it super easy to understand.  Follow the index at the top of the pages or look for the ""Next"" button at the bottom to navigate.  Even if you don't think you're interested, this is a MUST-PLAY-WITH tutorial.","http://cur.at/y1pPubN?m=web","25"
"techniques","Introduction to Machine Learning with Python and scikit-learn","Nice tutorial for getting started with machine learning using the Python package, scikit-learn.","http://cur.at/M3FjBVq?m=web","25"
"techniques","Find Waldo Faster","A month ago, Randy Olson blogged about using a variety of machine learning tricks to find Waldo.  Inspired by Randy's work, Vitaliy Kaurov from Wolfram dove into the problem and examined some additional approaches.  This is a great exploration with lots of diagrams and code snippets.","http://cur.at/2nbyl5R?m=web","25"
"techniques","Beginning deep learning with 500 lines of Julia","Why Julia?  ""It's concise, easy to understand, easy to extend, and reasonably efficient.""  Great tutorial.","http://cur.at/Pv1xg8x?m=web","25"
"resources","Data for Everyone Library","You'd be hard-pressed to find these datasets anywhere else.  This curated collection includes things like twitter sentiment on a variety of topics, labeled images, and crowdsourced colors in 9 languages.  All datasets have been cleaned and are available as csv files.  Definitely worth bookmarking.","http://cur.at/2WcR8qX?m=web","25"
"viz","Graph makeover: Measles heat map","This chart made the rounds on the Internet recently and drew a fair bit of criticism.  This is a worthwhile critique and offers some alternative ways of presenting the same data.","http://cur.at/7zda9kV?m=web","25"
"viz","Functional Dance Moves ","Follow this guy!  He's hilarious!  ","http://cur.at/4XmrkaE?m=web","25"
"news","On the Case at Mount Sinai, It’s Dr. Data","Jeffrey Hammerbacher is a number cruncher — a Harvard math major who went from a job as a Wall Street quant to a key role at Facebook to a founder of a successful data start-up.  Then he was given a medical diagnosis that changed everything.  Great read.","http://cur.at/yVKqeYm?m=web","26"
"news","The joyless world of data-driven startups","Everyone tells early stage startups to use data for big strategic decisions. But does that really work, and whatever happened to vision?","http://cur.at/SxK95h5?m=web","26"
"techniques","Extracting the original data from a heatmap image","Nice hack for reverse engineering the original values from a png image using R.","http://cur.at/7uC9qST?m=web","26"
"techniques","The Curse of Dimensionality and the Autoencoder","An autoencoder is an unsupervised learning technique that uses a neural network to produce a low dimensional representation of a high dimensional input.  This is high-level but is a good overview of how autoencoders work.","http://cur.at/IV6gE9q?m=web","26"
"resources","A Full Hardware Guide to Deep Learning","Interested in building a system that's optimized for deep learning? This article explains what you need and why. It's comprehensive with suggestions for RAM, CPUs, GPUs, cache, drives, etc, etc.  Think you have what you need already?  Read this to be sure.","http://cur.at/nWVRDsG?m=web","26"
"resources","An Incomplete Data Tools Landscape for Hackers in 2015","It isn’t long but this is a great slide deck by Wes McKinney that outlines key tools and libraries for working with data.  Wes started the Python pandas project and is the author of ","http://cur.at/ipcRAY1?m=web","26"
"viz","TimeLineCurator","If you ever have a document with time-oriented data or events that you'd like to display on a timeline, this is a great new tool to know about.  TimeLineCurator automatically extracts temporal references from ","http://cur.at/E9KOP2e?m=web","26"
"viz","Data Journalism Graphics","Nice collection of data journalism interactives by the ","http://cur.at/By7UZJm?m=web","26"
"news","DJ Patil Talks Nerdy To Us","Insightful interview with DJ Patil.  Along with offering insights into what he'll do as the U.S. Chief Data Scientist, he also reflects on the key things he's looking for when hiring for his team.  Perhaps not surprisingly, technical skills like Python aren't on his shortlist.","http://cur.at/OJjN8dK?m=web","27"
"news","Are Data Scientists Earning Their Salaries?","According to this article in ","http://cur.at/PEp6mfs?m=web","27"
"techniques","Artificial Neurons and Single-Layer Neural Networks - How Machine Learning Algorithms Work Part 1","If this article is any indication, Sebastian Raschka's upcoming book about Machine Learning is going to be awesome.  This is an easy to follow introduction with lots of diagrams and code snippets.  Both this article and his blog are highly recommended.","http://cur.at/kxAMlXV?m=web","27"
"techniques","Classifying plankton with deep neural networks","If you're interested in learning about how to approach image classification problems, don't miss this tutorial! This is a great breakdown of the National Data Science Bowl's winning solution.","http://cur.at/BLA4pJd?m=web","27"
"techniques","Introduction to the streamgraph htmlwidgtet R Package","Streamgraphs can be used to make compelling visualizations, especially when displaying large datasets. Here's a tutorial and R package for making streamgraphs via an htmlwidget.","http://cur.at/EzwvVkX?m=web","27"
"techniques","The Grammar of Data Science","Python and R are both popular for data exploration but which should you use and why?  This is by no means comprehensive but is a well-reasoned contribution to the Python versus R discussion.","http://cur.at/B1lgjzl?m=web","27"
"resources","Reflections on Julia","Julia is a relatively new language that could become the go-to choice for scientific computing, machine learning, data mining, large-scale linear algebra, distributed and parallel computing.  This is a great overview of what there's to like about Julia, useful packages, what's missing, tutorials, videos, resources, and examples.","http://cur.at/cvvzFxs?m=web","27"
"resources","Data manipulation, munging, and processing in JavaScript","Is data munging in JavaScript something you would actually want to do? Maybe. Python (with pandas) and R (with dplyr) already do a great job with data wrangling but if you're working with data in node.js or a browser, you won't have those options.  This is a well organized resource.","http://cur.at/Bw0ygvX?m=web","27"
"news","Peter Norvig: How Computers Learn","Peter Norvig, Google's Research Director, talks about his long experience in Artificial Intelligence and Machine Learning at the recent Vienna Gödel Lecture.  This is a very clear, amusing, and engaging presentation (starts at 10:56).  Highly recommended.","http://cur.at/CMRi3jl?m=web","28"
"news","Big Data / Analytics based startups at Y Combinator, Winter 2015 batch","Y Combinator is one of the most important accelerators for technology startups. Since 2005, it has funded over 800 new businesses with a combined valuation of over 30 billion dollars.  Here's a peek into the latest big data and analytics startups from last week's ","http://cur.at/khPpXOQ?m=web","28"
