"cat","item","desc","link","issue"
"resources","A Crash Course in Python for Scientists","If you're just getting into Python, this is a nice place to start.  Rick Muller of Sandia National Laboratories created this tutorial to help colleagues come up to speed quickly.  It starts with the basics and quickly gets into Numpy, Scipy, Matplotlib, and code optimization.  It's presented as an IPython notebook and includes lots of code snippets and references.","http://cur.at/WjcoIz9?m=web","36"
"resources","Deep Learning - An MIT Press Book in Preparation","MIT Press' ","http://cur.at/XsQ3LIE?m=web","36"
"news","New Approach Trains Robots to Match Human Dexterity and Speed","A group of researchers at the University of California, Berkeley have made some startling advancements recently.  They've built a robot that ","http://cur.at/Ws3VM6A?m=web","37"
"news","As a Major Retraction Shows, We’re all Vulnerable to Faked Data","An article that had been published in ","http://cur.at/ct9wFzN?m=web","37"
"news","Data Scientists Don’t Scale","Organizations that have managed to build data science teams are discovering unexpected limitations of human-powered data science: it’s not scalable.  This is a good overview of the issues and potential solutions which, ironically, will require data scientists to implement.","http://cur.at/OjgvKZW?m=web","37"
"news","Your Data Is Your Lifeblood - Set up the Analytics It Deserves","Ben Porterfield leads a group of engineers that are helping companies make better decisions.  In this interview, Porterfield explains the importance of an analytics infrastructure and shares his wisdom on where to store data, the best tools to use, common mistakes to dodge, and what you should measure to start making the right moves today.","http://cur.at/qJi8hH4?m=web","37"
"techniques","Introducing ShArc: Shot Arc Analysis","Great article exploring the NBA's SportVU motion tracking data.  ""We're spoiled for choice, with literally hundreds of thousands of data points, ","http://cur.at/BSnq7LA?m=web","37"
"techniques","Mean Shift Clustering","Well-written article describing the Mean Shift clustering algorithm.  The diagrams, code snippets, and comparison with other techniques make it easy to understand how this algorithm works.","http://cur.at/dpfA3tZ?m=web","37"
"resources","Start Learning with the Summer of Data Science","It's MOOC season!  This is a nice overview of upcoming data-related courses from edX, Udacity, and Coursera.  If you don't have time for MOOCs, this post also includes a list of data science journals that are worth paying attention to.","http://cur.at/Q3x4WdR?m=web","37"
"resources","Statistics Done Wrong"," is a guide to the most common statistical errors and slip-ups committed by scientists every day. It assumes no prior knowledge of statistics, so ""you can read it before your first statistics course or after thirty years of scientific practice.""","http://cur.at/OL6EV85?m=web","37"
"resources","METACRAN: Search and browse all CRAN/R packages","Simple and comprehensive search engine for R packages.  This is a newly released ""alpha"" version but very well done and worth using.  The code behind this is available on Github and contributions are welcome so expect this resource to keep getting better.","http://cur.at/uPjju4X?m=web","37"
"viz","jsGraphs","Comprehensive and well-organized collection of JavaScript libraries for data visualization. There are a lot of libraries here but multiple cross-filters make it easy to zero-in on options.","http://cur.at/hovYNtZ?m=web","37"
"viz","You Draw It...","Brilliant!  A key objective of data visualization is to enable and motivate people to engage with the data.  In this piece from the New York Times, readers ","http://cur.at/da5WzAe?m=web","37"
"viz","Data Stories #54 Designing Exploratory Data Visualization Tools w/ Miriah Meyer","This is my favorite ","http://cur.at/Z41ViDj?m=web","37"
"news","Virtual Eyes Train Deep Learning Algorithm to Recognize Gaze Direction","Gaze estimation is a classic problem of machine vision, which can now be solved by one computer training another.  Here's a good overview of how that works.","http://cur.at/67drCG3?m=web","38"
"news","Computer Scientists are Astir after Baidu Team is Barred from A.I. Competition","A group of researchers at Baidu have been barred from participating in a major international AI competition when it was discovered that they gamed the system.  Here's what happened and why it's a big deal.","http://cur.at/a2R9o7d?m=web","38"
"news","Sharing Data, but Not Happily","It's no surprise that a lot of people think personalized services and targeted advertising is NOT a fair exchange for their personal data.  New studies reveal exactly what people are comfortable with and how that will ultimately impact research in the near future.","http://cur.at/B2EUMVF?m=web","38"
"news","Robotics: Ethics of Artificial Intelligence","In this article in ","http://cur.at/OYVo9vX?m=web","38"
"techniques","Aerosolve: Machine Learning for Humans","Airbnb helps its hosts set reasonable prices by showing the probability that a listing will be accepted.  Many features go into predicting the demand for a listing and these features interact in complex ways.  To help users understand the results, Airbnb has created Aerosolve: ""a machine learning package built for humans.""  This article on Airbnb's engineering page is a worthwhile overview of why it's valuable and ","http://cur.at/kDDVLRp?m=web","38"
"techniques","Ultimate Guide for Data Exploration in Python using NumPy, Matplotlib and Pandas","Great reference for exploring data with Python.  There are lots of tricks here that are worth being familiar with.  Give it a skim and then bookmark it.","http://cur.at/SgfAn7L?m=web","38"
"resources","The Unknown Perils of Mining Wikipedia","Because of the breadth and availability of its content, Wikipedia has been widely used as a reference dataset for research in machine learning.  That seems reasonable but unfortunately, a large percentage of Wikipedia pages are essentially fluff that have been created by robots.  Here's a short article explaining the problem with a link to a cleaned Wikipedia dataset.","http://cur.at/QGNlRUQ?m=web","38"
"viz","Data Visualisation Resources","Andy Kirk has recently updated his collection of resources on his ","http://cur.at/xUpCSD6?m=web","38"
"viz","On Visualizing Data Well","William Zinsser authored a classic writing book called, ","http://cur.at/Gip9KNa?m=web","38"
"news","Machine Vision Algorithm Chooses the Most Creative Paintings in History","So how does a machine determine what's creative?  It's a network problem.","http://cur.at/gueMpyb?m=web","39"
"news","Planarian Regeneration Model Discovered by Artificial Intelligence","An AI system was recently credited with not just ","http://cur.at/R7dpONm?m=web","39"
"news","Algorithms of the Mind","How machines ","http://cur.at/IZu7hzS?m=web","39"
"news","Data, Startups And Doing Things That Matter","There are lots of startups doing things that matter.  Here's a rundown of many you may not have heard of yet and how data is propelling their success.","http://cur.at/Uz0IMBR?m=web","39"
"techniques","Why has R, Despite Quirks, been so Successful?","This is worthwhile post that got a lot of attention around the web this week.  Along with the 40 minute video, there's a good write-up that identifies R's most popular and important quirks.","http://cur.at/sq0dtO9?m=web","39"
"techniques","10 Rules for a Better SQL Schema","These are key tips for working with databases.  This article targets schema design but even if you're not designing databases, understanding how things work under the hood will be useful to anyone who works with SQL.","http://cur.at/tkZJu2k?m=web","39"
"techniques","Mortgages Are About Math: Open-Source Loan-Level Analysis of Fannie and Freddie","Great walk-through of a loan-level analysis of Fannie and Freddie data. The analysis is told as a story with code snippets, data visualizations, and discoveries along the way.  The code, including scripts to access the data, is also available in a ","http://cur.at/XNuADnH?m=web","39"
"resources","Python for Informatics"," is an informatics-oriented approach to learning Python.  This is a free book and is available in a variety of downloadable formats.  If you prefer print, it's also available on Amazon where it has very high reviews.","http://cur.at/Cll2MO9?m=web","39"
"viz","CSE512 Data Visualization","I don't typically link to course syllabi but this one is particularly worthwhile.  This is for Jeffrey Heer's latest Data Visualization course at the University of Washington. The course is well organized and everything is linked, including required readings, course slides, and assignments.  This is a fantastic collection of Data Visualization MUST READS and, with the assignments and slides too, it's a great resource for self-study.  Highly Recommended.","http://cur.at/XycLMd1?m=web","39"
"viz","Escher","Escher lets you build beautiful interactive Web UIs in Julia.  If you're using Julia, you'll definitely want to check this out.","http://cur.at/21MUWgV?m=web","39"
"news","Deep Learning Machine Beats Humans in IQ Test","Computers have never been good at answering the type of verbal reasoning questions found in IQ tests. Now a deep learning machine unveiled in China is changing that.","http://cur.at/ZUC14wS?m=web","40"
"news","A New Window Into Our World With Real-time Trends","Google made some big improvements to its ","http://cur.at/8PPYMHY?m=web","40"
"news","Inside Obama's Stealth Startup"," Great article about how that's going.","http://cur.at/AqaNf8X?m=web","40"
"techniques","MarI/O - Machine Learning for Video Games","Brilliant video showing how the guts work for this machine learning algorithm.  It's just 6 minutes and if you want more, there are links to the source code and a paper.  Highly Recommended.","http://cur.at/qMPu0Y2?m=web","40"
"techniques","Inceptionism: Going Deeper into Neural Networks","This post in Google's research blog explores some simple techniques for looking inside neural networks.  The results are fascinating and have generated a lot of discussion around the web this week. The article is easy to follow and it's also worth checking out ","http://cur.at/u74zukk?m=web","40"
"techniques","R Packages","Packages are the fundamental units of reproducible R code. They include reusable R functions, the documentation that describes how to use them, and sample data.  If you use R, definitely check out this site by Hadley Wickham that goes along with his new book ","http://cur.at/C9gOYbN?m=web","40"
"resources","Data Science iPython Notebooks","Nice collection of curated iPython notebooks for Data Science. These notebooks cover topics for Spark, Hadoop MapReduce, HDFS, AWS, Kaggle, scikit-learn, matplotlib, pandas, NumPy, SciPy, and various command lines.","http://cur.at/oX6cssH?m=web","40"
"resources","Computational Statistics in Python","Online text for a computational statistics course at Duke University.  The text is Python-based but there are lots of code samples and it should be easy to follow even if you're not a Python pro.  This is definitely worth bookmarking.","http://cur.at/LK5EYha?m=web","40"
"viz","Exploring the 7 Different Types of Data Stories","This article explores seven ways to tell the story of a single dataset.  It's not exhaustive but there are good ideas here for creating your own data narratives.","http://cur.at/ZrawrpH?m=web","40"
"news","When Health Care Gets a Healthy Dose of Data","American health care is undergoing a data-driven transformation - and Intermountain Healthcare is leading the way. This case study by ","http://cur.at/jlh89zA?m=web","41"
"news","Algorithmic Hiring: Point / Counterpoint","The ubiquity of data has helped fuel several startups and lots of discussion about the value of algorithmic hiring. These two thought-provoking articles discuss opposite approaches and have implications beyond just hiring. Data vs gut... what works, when?","No link present","41"
"news","How Data Science Shaped This Teen-Counseling-By-Text Service","Two years after its launch, ","http://cur.at/rtIIssA?m=web","41"
"news","The Future of Algorithmic Personalization","Interesting read about why that is and how to fix it.","http://cur.at/p8ugYZZ?m=web","41"
"techniques","Top 10 Data Mining Algorithms in Plain R","Worthwhile followup article to last month's ","http://cur.at/Gzyzx0F?m=web","41"
"techniques","Document Clustering with Python","Great tutorial showing how to cluster a set of documents using Python.  Includes a Github repo with interactive notebook.","http://cur.at/bO6gFMU?m=web","41"
"techniques","Building Analytics at 500px","Here's a good look into the thought processes and challenges involved with building analytics from the ground up at a mid-sized start-up.","http://cur.at/avZQMFE?m=web","41"
"resources","UC Irvine Machine Learning Repository","The University of California at Irvine maintains these 300+ datasets that are curated specifically to support machine learning research.  It was established in 1987 and has since been cited over 1000 times, making it one of the top 100 most cited ""papers"" in all of computer science.  Each dataset is well documented, including a description, attribute information, and links to relevant papers.","http://cur.at/Du2wioK?m=web","41"
"viz","Excel Map Hack","This map of historic tornado hot spots is really just an Excel pivot table!  Read on to see how to spatial-hack Excel in this devious way.","http://cur.at/lKJHd68?m=web","41"
"viz","Beyond Tufte","Nice rundown of some great data visualization books.  Along with useful descriptions, this post contains page scans and lots of linked references.  This is a great reading list!","http://cur.at/VbdK7Vp?m=web","41"
"news","Paired With AI and VR, Google Earth Will Change the Planet"," project has enabled anyone with an Android or iPhone to have an inexpensive virtual reality viewer.  Imagine pairing that with Google Earth and even better, add a neural net to discover interesting places. This is going to be awesome.","http://cur.at/VDJHziM?m=web","42"
"news","How We Scaled Data Science to all Sides of Airbnb Over 5 Years of Hypergrowth","Great first-hand account of building a data science culture from scratch to help manage ","http://cur.at/H3tHQrs?m=web","42"
"news","Artificial Intelligence Machine Gets Testy With Its Programmer","Fun, short read based on a recent Google paper. The Google paper is actually about modeling conversation but the media picked through it for examples of how ","http://cur.at/Ne2hiQY?m=web","42"
"news","MIT’s Bitcoin-Inspired ‘Enigma’ Lets Computers Mine Encrypted Data","Interesting encryption scheme developed at MIT Media Lab that could be a game changer for facilitating online data transactions.  This is a great description of how it works with links to details.","http://cur.at/AzhWXPn?m=web","42"
"techniques","Deep Dreams (with Caffe)","This IPython notebook from Google Research demonstrates how to produce ""dream"" visuals like those that have been proliferating around the web this week.  This provides an easy way to play with the ideas in their article from last month called ""Inceptionism: Going Deeper into Neural Networks."" That article was wildly popular and this notebook will likely fuel the enthusiasm.","http://cur.at/vhz2Lzx?m=web","42"
"techniques","Deep Down the Rabbit Hole: CVPR 2015 and Beyond","CVPR is the premier Computer Vision conference, and it's fair to think of it as the Olympics of Computer Vision Research.  This is a great rundown of what's happening in the field, including lots of linked references.","http://cur.at/8uySSdq?m=web","42"
"resources","16 Free Data Science Books","16 free data science books covering statistics, Python, machine learning, the data science process, and more.","http://cur.at/oEdYQVh?m=web","42"
"viz","Visualizing Google Forms Data with Python and Seaborn","Google makes it easy to collect information through simple web forms.  But then what?  This is the second of a two-part series that shows how to access the data in a Google Form, read it into a pandas dataframe, and analyze it.  The examples are simplistic, which makes them easy to understand and apply to your own use-cases.","http://cur.at/LMpFs5e?m=web","42"
"viz","Designing Data-Driven Interfaces","Nice overview of how to design for the human side of data interaction.","http://cur.at/ulYcv07?m=web","42"
"viz","Data Becomes Art in Immersive Visualizations","Big data and art are converging in electrifying ways. In this new video by the ","http://cur.at/6p0QiTM?m=web","42"
"news","Google's Deep Learning Machine Learns to Synthesize Real World Images","Give Google’s DeepStereo algorithm two images of a scene and it will synthesize a third image from a different point of view.  That becomes interesting really fast when integrated with Street View.  Check out the video.  It's amazing.","http://cur.at/DVa0DXu?m=web","43"
"news","Machine ethics: The robot’s dilemma","Working out how to build ethical robots is one of the thorniest challenges in artificial intelligence.  Rule-based decisions facilitate implementation but rules are limited by preconceived imaginations.  Thought-provoking article.","http://cur.at/yfiAqLz?m=web","43"
"news","Why Google's New Patent Applications are Alarming","Google has filed for some machine learning patents recently that are creating a bit of a stir.  Is Google being evil or is Google protecting innovation here?  This is an interesting Reddit discussion and it's worth being familiar with the issues.","http://cur.at/cmOGWzp?m=web","43"
"techniques","A Quick Puzzle to Test Your Problem Solving","Think you're a good problem solver?  This short quiz may surprise you.","http://cur.at/WlFPmjc?m=web","43"
"techniques","SciPy 2015: Scientific Computing with Python Conference"," collection of talks from the recent SciPy conference - great speakers and great talks.  If you work with Python, it's worth at least skimming this list.  You'll likely find something that grabs your interest.","http://cur.at/LFSYPwP?m=web","43"
"techniques","Pandas Categoricals","Nice trick.  Pandas Categoricals enables you to represent text data numerically to get an order of magnitude speedup on queries.  This is a good overview of how to use it.","http://cur.at/vgHCrVT?m=web","43"
"resources","5 Open Source Tools for Taming Text","Text is everywhere and natural language processing is becoming increasingly capable and important.  Here's a nice collection of open source tools to help with things like sentiment analysis, topic identification, and automatic labeling of content.","http://cur.at/fjKFfR0?m=web","43"
"resources","Top Videos on Machine Learning, Neural Network & Deep Learning","Curated collection of YouTube videos for learning about machine learning, neural nets, and deep learning.  There are a lot of interesting picks here and some are just a few minutes long.","http://cur.at/DL0gIp5?m=web","43"
"resources","Resources for Doing Data Journalism with R","Lots of R tools and tutorials here to help gather, analyze, and tell data stories.  Contributions are welcome via GitHub.  It would be great to see this continue to evolve.","http://cur.at/KxYf5xJ?m=web","43"
"viz","What Is A Creative Data Scientist Worth?","Beautiful and hypnotic, these images are adding a new dimension to data analytics.  Is it art?  And if so, how much value is added to the analytics?  Interesting article and be sure to check out ","http://cur.at/xdWFwEa?m=web","43"
"viz","Talking with… Giorgia Lupi","And speaking of artistry, Visual Loop published this interview with Giorgia Lupi this week.  Giorgia is a co-founder of Accurat – the hugely popular, data-driven research, design and innovation firm.  There are some real gems in this interview, including insights into the future of custom data visualization work.","http://cur.at/Gcy4TPK?m=web","43"
"viz","Vizipedia - Data Visualization Library","Collection of 93 data visualization strategies with links to examples and resources.  These are organized by strategy types (e.g. correlations, flows, networks, predictive, etc.) and it's easy to find examples that match specific needs.  Great resource.","http://cur.at/TJFSXuC?m=web","43"
"news","A first exploration of a new planet will never happen again in our lifetimes.","The New Horizons spacecraft reached Pluto this week, which is an incredible achievement, in itself, but it's the ","No link present","44"
"news","The Data or The Hunch","More and more decisions, from the music business to the sports field, are being delegated to data.  This is a thought-provoking exploration of how well that actually works.","http://cur.at/wVhs2qV?m=web","44"
"news","Welcome to the AI Conspiracy: The ‘Canadian Mafia’ Behind Tech’s Latest Craze","Deep learning is all the rage these days but it wasn't always that way.  In the late 90s, it was seen as the stuff of science fiction and was considered to be a dead-end for smart researchers.","http://cur.at/8bsjNTq?m=web","44"
"news","Welcome to the AI Conspiracy: The ‘Canadian Mafia’ Behind Tech’s Latest Craze","This is the story of three computer scientists who chose that path anyway and laid the foundation for the next frontier in AI technology: Geoffrey Hinton, Yann LeCun and Yoshua Bengio.  Great read.","http://cur.at/8bsjNTq?m=web","44"
"techniques","A Neural Network in 11 lines of Python","Great tutorial that teaches backpropagation via a simple python example.  This is very well explained and includes worthwhile suggestions for further learning.","http://cur.at/XFr61WS?m=web","44"
"techniques","Linear Algebra for Data Scientists with Python","Quick review of key linear algebra concepts with examples using Python's numpy package.","http://cur.at/zH6PWU?m=web","44"
"resources","Neural Networks and Deep Learning","Draft version of a free online book that that includes many of the core concepts behind neural networks and deep learning.  This ""book"" uses a hands-on approach and includes a repository of code samples.","http://cur.at/RWqHWje?m=web","44"
"resources","Sports Data and R","Nice collection of R packages for accessing sports data.  There's a wide range of sports represented here, including baseball, basketball, the Olympics, cricket, football (""soccer"" in the U.S.), American football, hockey, skiing, swimming, etc, etc.","http://cur.at/KPi8aBp?m=web","44"
"resources","The Definitive Guide to Do Data Science for Good","Great collection of organizations, competitions, meetings, and jobs for ""doing good"" with data science.  Many of these would also be great opportunities as career stepping stones.","http://cur.at/9y4NS2R?m=web","44"
"viz","Vega 2.0","Vega is a visualization grammar - a declarative format for creating, saving, and sharing interactive visualization designs.  Vega 2.0 was released this week and includes support for interactivity and streaming data.  There's a lot of thought going into this project, it's very well documented and is worth being familiar with.","http://cur.at/WzHC0jc?m=web","44"
"viz","A Welcome Development for Matplotlib","matplotlib will soon have a new default colormap which is ""perceptually-accurate.""  This short talk describes what that means and why it's important. The changes are motivated by concerns that go beyond matplotlib and should be understood by ","http://cur.at/YJOeY9T?m=web","44"
"viz","d3 Legend","Yay!  A legend component for D3!  If you work with D3, this will be super useful.","http://cur.at/FkC6cr1?m=web","44"
"news","An Executive’s Guide to Machine Learning","This McKinsey Report provides a great overview of machine learning for smart people that aren't necessarily machine learning experts. This is really an opportunities and strategies report for the C-Suite, which provides insights into how well machine learning is understood and appreciated by decision-makers.","http://cur.at/Elv5UgN?m=web","45"
"news","Can Police Use Data Science to Prevent Deadly Encounters?","As part of Obama's Police Data Initiative, researchers are studying predictive analytics to identify officers whose unprofessional behavior ","http://cur.at/pxL1Jw3?m=web","45"
"news","We Are Data: The Future of Machine Intelligence","Thought-provoking essay about freedom and control in a world driven by metadata.  ","http://cur.at/RUANcBL?m=web","45"
"techniques","Python at Scale for Data Science","Nice overview of a new data analysis framework called ""Ibis"" that has the goal of making big data as easy to work with as small data.  It’s exactly the same Python you know and love but at scale.","http://cur.at/wkjyGBU?m=web","45"
"techniques","This R Data Import Tutorial Is Everything You Need","Comprehensive tutorial for importing data into R.  This is easy to follow and covers a wide variety of file types.","http://cur.at/PeXpHWv?m=web","45"
"techniques","Exploring the Shapes of Stories Using Python and Sentiment APIs","Nice tutorial that explores the use of sentiment APIs to plot the ","http://cur.at/xbHuxsn?m=web","45"
"resources","Machine Learning Course from CMU by Alex Smola","This course is a deep dive with mathematical proofs, detailed references, and links to additional resources.  Slides and videos are available in each section of the outline and a searchable/tagged collection of videos is also available at ","http://cur.at/6JLj9ii?m=web","45"
"resources","Awesome RNN","Curated collection of resources dedicated to recurrent neural networks. This collection includes code, lectures, books, papers, datasets, and lots of applications. If you're interested in recurrent neural networks, this is a project to watch.","http://cur.at/aMKlovz?m=web","45"
