"cat","item","desc","link","issue"
"news","What I Learned As Pandora’s First Data Scientist","Gordon Rios has been instrumental in building up a team of data scientists at Pandora.  In this interview, Rios offers his insights into what worked and what didn't as he built the team from just himself to over a dozen.  An interesting and important read for anyone interested in building a data science team.","http://cur.at/OP9hdZn?m=web","1"
"news","Why “Big Data” Is a Big Deal","The title says it all.  Here’s an in-depth overview from Harvard Magazine about the importance of Big Data, its uses, and where things are going.  This is a great read.","http://cur.at/ffahPlf?m=web","1"
"news","A Dating Site for Algorithms","A startup called Algorithmia has a new twist on online matchmaking. Its website connects businesses that have lots of data to researchers that have developed powerful but largely unknown algorithms.  This will be an interesting company to watch.","http://cur.at/TioA7GY?m=web","1"
"news","Extreme Moneyball: The Houston Astros Go All In on Data Analysis","Is data the future of sports?  These guys sure think so.  The Astros front office is full of engineers, data scientists, and a physicist.  They call their office ""The Nerd Cave,"" and it's lined with whiteboards ""covered with algebraic formulas."" Clearly, this is a work in progress but the story is a worthwhile look into the data players of the sports world.","http://cur.at/Z1pCY85?m=web","1"
"techniques","Putting Science First - Distinguishing Visualizations from Pretty Pictures","Is it art?  Or is it science?  Andrew Hanson explores these questions in IEEE's ""Computer Graphics and Applications"" magazine and shows why data visualizations should probably be a bit of both.","http://cur.at/GM7pQ9L?m=web","1"
"techniques","Buffer's Big List of Twitter Tools","For anyone interested in working with Twitter, Buffer’s list of tools is a treasure.  There are 59 free tools here that aid analytics, discovery, and tweet management.  Great resource.","http://cur.at/dpAUvW6?m=web","1"
"resources","The Data Journalism Handbook","The Data Journalism Handbook provides a good overview of working in this burgeoning field.  It includes in-depth case studies, sources for data, help for understanding data, and ideas for telling data stories.  The book is free to read via the link here or you can purchase a printed copy from O’Reilly.","http://cur.at/XwnjNRa?m=web","1"
"resources","Military Surplus Gear","This spreadsheet shows military equipment that’s been given to state and local law enforcement agencies by the Defense Department.  It was released in the Spring and became very pertinent recently with the Ferguson riots.  This data has already been cleaned and is easy to work with.","http://cur.at/OfzLUqu?m=web","1"
"resources","Quandl Phase 2: The Democratization of Commercial Data","If you’re looking for data, Quandl is a good place to start.  Quandl offers unlimited and unrestricted access to over 10 million time-series datasets - for free.  And in this bold blog post, Quandl founder, Tammer Kamel, says, “Our ultimate objective is nothing less than everything: all numerical data in the world available on Quandl.”  This is a company worth paying attention to.  They offer a large variety of curated datasets, an API and libraries to work with many popular programming languages.","http://cur.at/cBtzK8Y?m=web","1"
"viz","Bloomberg Industry Leaderboard","If you believe a lot of what's being written about the markets lately, you’d think a bubble was about to burst.  But this interactive by Bloomberg’s Visual Data Group suggests that’s far from true.  There is a lot to explore here.  Be sure to click on the drop-down list of questions at the top and from there, click about anywhere to drill deeper.","http://cur.at/irgOII2?m=web","1"
"news","IBM Offers a Data Tool for the Mainstream, With Watson's Help","Remember Watson?  Three years ago it beat Jeopardy's brightest using cutting-edge natural language analytics.  This week, IBM is making it available to the masses.","http://cur.at/Ni0chU9?m=web","2"
"news","Did You Know You Had Diabetes? It's All Over the Internet","""Dan Abate doesn’t have diabetes nor is he aware of any obvious link to the disease. Try telling that to data miners....""","http://cur.at/NiufgKx?m=web","2"
"news","Google Report Shows Governments' Increasing Demands for Users' Data","According to Google's latest Transparency Report, the number of government data requests has been rising sharply.  Requests come from around the world and from governments of all sizes.  Read this article to find out how often Google says, ""No.""","http://cur.at/8P8CJwh?m=web","2"
"news","OkCupid’s Unblushing Analyst of Attraction","OkCupid has become well-known for turning its user's dating data into sociological studies.   Its president, Christian Rudder, talks about why that's okay and where things are going.","http://cur.at/eqSOhST?m=web","2"
"techniques","More Than Meets the Eye: NASA Scientists Listen to Data","Great story about turning data into sound for analysis - with sound clips and visuals too.  Check it out and if you're interested in learning more,  see the free Sonification Handbook at ","http://cur.at/zHGJVOZ?m=web","2"
"techniques","DataCollection.js","Nice JavaScript library for working with data in a browser.  Lots of options here.","http://cur.at/nUHlaIK?m=web","2"
"resources","IEEE Special Report: Big Data ","This Special Report by the IEEE covers a lot of ground in the Big Data arena.  There are articles here about big data and health care, crime prevention, career paths in big data, new directions in the field, upcoming conferences, data scientist profiles, etc, etc. This is worth spending some time with.","http://cur.at/mfiUoEj?m=web","2"
"viz","The trouble with the Purple election map","Nice article by Lawrence Weru demonstrating a ""Neutralizing"" map and why it's better for detecting margins.","http://cur.at/FiYgZnT?m=web","2"
"viz","earth :: an animated map of global wind, weather, and ocean conditions","This near real-time, animated wind map is stunning.  And it became all the more potent this week when the author, Cameron Beccario, spoke at the Graphical Web conference about how he built it.  It's worth playing with the globe and if you're interested in the backstory, definitely check out the presentation:  ","http://cur.at/Umkwhom?m=web","2"
"news","yCombinator 2014 Data Science Start-ups","Interested in what's new in data-related startups?  This article takes a look at the data science start-ups from the latest yCombinator batch.  This year's class has 68 startups.  Guess how many are related to data science?","http://cur.at/yMnWI1H?m=web","3"
"news","Predicting crime with Big Data - welcome to ""Minority Report"" for real","Predictive analytics has become very sexy over the last few years and has produced some impressive insights into human behavior and, occasionally, problematic revelations...","http://cur.at/gfajR7C?m=web","3"
"news","Forget GMOs. The Future of Food Is Data—Mountains of It","Mixing and matching proteins found in the world’s plants, this small startup already has created a reasonable facsimile of the chicken egg—an imitation of the morning staple that’s significantly cheaper, safer, and possibly healthier than the real thing—and now it’s working to overhaul other foods in much the same way.","http://cur.at/6Squrub?m=web","3"
"techniques","Dat - Build data pipelines","Dat is an open source project that provides a streaming interface between every file format and data storage backend.  Housed in the US Open Data Institute, Dat aims to bring to data a style of collaboration similar to what git brings to source code.","http://cur.at/p0YCkbd?m=web","3"
"techniques","CartoDB Twitter Maps","CartoDB Twitter Maps offers the ability to do geospatial analysis and visualization of Twitter activity.  Free accounts let you access twitter data from the past 30 days and easily create interactive maps showing data over time.  Check out the gallery.","http://cur.at/GDmnRd8?m=web","3"
"techniques","Something About Cats, Dogs, Machine and Deep Learning","Useful article and links about the challenges of computational deep learning.","http://cur.at/Xga3VJJ?m=web","3"
"resources","The Data Visualisation Catalogue","NIce collection of data visualization strategies with tips about use cases and creation tools.  This resource is growing and worth paying attention to.","http://cur.at/fSai1Ce?m=web","3"
"viz","Color Scales","Nice tutorial by the team at Interactive Things about creating color scales for interactive charts and visualizations.","http://cur.at/XMjpjdv?m=web","3"
"viz","Green Honey","Great article about representing data in visualizations.  The D3 animations that go along with the article really pull this together.  This is the future of story-telling.","http://cur.at/Cvgu71P?m=web","3"
"news","The Odds, Continually Updated","Bayesian statistics are rippling through everything from physics to cancer research, ecology to psychology. Enthusiasts say they are allowing scientists to solve problems that would have been considered impossible just 20 years ago.  This article from the New York Times explains how.","http://cur.at/NVWfDOJ?m=web","4"
"news","How Big Data Is Failing Us","Big Data is only as good as the data it contains.  This article explores the dark side of Big Data.  Think you know its blind spots?  Read on to find out.","http://cur.at/QjTmTh5?m=web","4"
"techniques","How to use R, H2O, and Domino for a Kaggle competition","Detailed case-study of how to tackle a Kaggle competition.  With sample code and data, this is a very worthwhile introduction to machine learning.","http://cur.at/cbDYLgd?m=web","4"
"techniques","Beaker Notebook","Version 1.0 of Beaker was just released.  This is an open-source notebook-style development environment for working interactively with large and complex datasets. Beaker works with a variety of languages and is definitely worth exploring.","http://cur.at/3ufTt4s?m=web","4"
"techniques","marckhoury/mars · GitHub","This new tool can compute stress majorization based layouts for graphs with as many as several hundred thousand nodes.  That's well beyond the limits of standard stress majorization layout algorithms.  The technical details at the bottom of the project's page explain how that's done.","http://cur.at/cvokAny?m=web","4"
"resources","In-depth introduction to machine learning in 15 hours of expert videos","Interested in learning about machine learning?  Check out this video series, presented by two Stanford professors.  If 15 hours of video is a bit daunting, the text that goes along with this series is freely available and is a well-organized reference: ","http://cur.at/cCpuUYN?m=web","4"
"viz","A Big Article About Wee Things","This is an article about design. And specifically, the little things in design that can make or break a data visualization. This is very well done with lots of examples.","http://cur.at/JgTFMWp?m=web","4"
"viz","MLDemos - A visualization tool for machine learning","Here's one more great resource for learning about machine learning. MLDemos is an open-source visualization tool for studying how these algorithms work.  Fun to play with!","http://cur.at/ExzCyiE?m=web","4"
"viz","Interactive Data Visualization for the Web","D3 has become the standard for building data visualizations on the web.  Scott Murray's book, ""Interactive Data Visualization"" offers a great introduction to D3 and has just been made available as a free online resource with interactive examples.  If you have any interest in building data visualizations for the web, this is a must play-with, online read.","http://cur.at/2fGr9ml?m=web","4"
"news","Can Big Data Tell Us What Clinical Trials Don’t? ","Doctors and scientists are increasingly dipping into the aggregated medical records of millions of patients to uncover patterns that might help steer care.  Godsend?  Or privacy concern?","http://cur.at/uKLsYH0?m=web","5"
"news","Open Data Beyond the Big City","Open data is the future — of how we govern, of how public services are delivered, of how governments engage with those that they serve. And right now, it is unevenly distributed. This article explains why we should care and offers suggestions for how to fix it.","http://cur.at/WwkRpC2?m=web","5"
"techniques","Eleven Awesome Things You Can Do with csvkit","csvkit started out as a small newsroom tool that made it easy to select a subset of columns from a csv file.  Five years later, this tool has become a data swiss army knife.  This article describes some of its most useful features which include input, processing, and output operations. If you ever work with data in an Excel or csv file, this tool is a must!","http://cur.at/5HNsVNW?m=web","5"
"techniques","DIMSUM - An open-source recommendation algorithm for massive datasets","Twitter recently open-sourced an algorithm designed to ease the process of running recommendation engines at large scale. This article describes how it works and when it might be useful.","http://cur.at/Ic4WiLb?m=web","5"
"techniques","Finding Stories in Census Data","This isn't just an article about how to find stories in census data.  This article lays out a strategy for finding stories in ","http://cur.at/CAdQEjK?m=web","5"
"resources","Opening up the BBC's Linked Data","BBC just released an open data website that includes data on the places, people and organisations that appear in BBC programs and online content. This data already powers large parts of the BBC website, including BBC News and Sport, and is now available for anyone to access in standard open data formats.","http://cur.at/ExSVaDb?m=web","5"
"resources","Journalist datastores: where can you find them? A list","Well-known for his data visualization work, Simon Rogers has started this list of key resources for finding the data that's used by journalists.","http://cur.at/Hwl7e6U?m=web","5"
"resources","20 Free Big Data Sources Everyone Should Know","Great list of some of the best free big data sources available today.  If you don't have a need for it now, this is definitely worth bookmarking.","http://cur.at/KC0DJJg?m=web","5"
"viz","Unlocking Big Data: Lessons Learned From The God Particle","It’s a puzzle wrapped in an enigma wrapped in a symphony. It’s the Higgs boson, the so-called God particle, the greatest physics find of the 21st century, turned into music and ultimately, visualizations.  Does this strategy of using multiple sensory streams to analyze large amounts of data really work?","http://cur.at/Hejd5DX?m=web","5"
"viz","Floodwatch - You are not your browser history","We spend hours a day online, and we see ads on every webpage we visit. But we don’t have any way of tracking the ads we’re being served.  Until now.","http://cur.at/kr0XAYM?m=web","5"
"viz","Floodwatch - You are not your browser history","Floodwatch is a Chrome extension that tracks the ads you see as you browse the internet.  This is a Jer Thorp project, complete with personalized data visualizations.  You don't want to miss this.","http://cur.at/kr0XAYM?m=web","5"
"news","CDC Tracks Cell Phone Location Data to Halt Ebola","The Defense Department has re-engineered a system geared for identifying weapons of mass destruction to instead flag the onset of Ebola outbreaks.  It's not perfect.  But it's an interesting approach with lots of potential.","http://cur.at/9BLEmKu?m=web","6"
"news","G.E. Opens Its Big Data Platform","Predix is the heart of GE's Internet of Things business that will surpass $1 billion in revenue this year.  It's optimized for real-time, large-scale analytics and GE is opening up this platform for widescale use.  This article explains why that matters.","http://cur.at/FzKX8uq?m=web","6"
"news","How Big Data Is Changing Medicine","What’s Safer? Data Or a Team of Doctors?","http://cur.at/XVHx1pw?m=web","6"
"news","Counting trees to save the woods: using big data to map deforestation","Big data comes with big challenges. Global Forest Watch has grappled with a number of issues that are common to data-driven initiatives. This article examines what they learned.","http://cur.at/dhqoBVu?m=web","6"
"techniques","Six of the Best Open Source Data Mining Tools","Here are six powerful open source data mining tools to accomplish tasks using artificial intelligence, machine learning and other techniques to extract value from data.","http://cur.at/xr8552G?m=web","6"
"techniques","Data Science Toolkit","Steal this server!  This collection of tools is available as a self-contained, ready-to-run VM.  It includes a variety of tools related to geo-coding, sentiment analysis, file conversions, and statistics.","http://cur.at/su3bPKE?m=web","6"
"resources","The Open Source Data Science Masters","With Coursera, ebooks, Stack Overflow, and GitHub -- all free and open -- how can you afford not to take advantage of an open source education?  This is a well-organized collection of online resources for learning about things like algorithms, data science, machine learning, data viz, etc, etc.","http://cur.at/haq2Z9V?m=web","6"
"viz","Bokeh 5-minute Overview","Bokeh is a data visualization library that lets Python programmers create interactive, novel, plots for the web.  This project is definitely worth being familiar with.  It works with iPython Notebooks or can also be used to create standalone HTML.  Its capabilities are often compared to D3.  Also see Peter Wang's presentation from the SF Python Meetup Group for an excellent tour of what this library can do:  ","http://cur.at/VrflUgQ?m=web","6"
"viz","30 amazing data viz galleries everyone should follow","Exploring this collection is a MUST for anyone interested in data visualization.   This is showcase of the very best examples and practices. These are the online galleries to keep up with.","http://cur.at/bumCO2r?m=web","6"
"news","With Big Data Comes Big Responsibility","The success of the Internet of Things relies on the premise that all the data being generated by internet companies and devices scattered across the planet belongs to the organizations collecting it. What if it doesn’t?  This is must-read interview with Alex “Sandy” Pentland from the MIT Media Lab about data ownership.","http://cur.at/ADthtUr?m=web","7"
"news","Machine-Learning Maestro Michael Jordan on the Delusions of Big Data and Other Huge Engineering Efforts","""The overeager adoption of big data is likely to result in catastrophes of analysis comparable to a national epidemic of collapsing bridges.""  That sentiment might be easy to dismiss if it wasn't coming from someone as highly regarded as Michael I. Jordan, who is one of the world’s most respected authorities on machine learning.  This is a thought-provoking read.","http://cur.at/eWwOHPK?m=web","7"
"techniques","Visualizing MNIST: An Exploration of Dimensionality Reduction","At some fundamental level, no one really understands machine learning. Humans do really well with two and three dimensions, not thousands.  But by directly observing what is actually happening, step by step, this tutorial provides an opportunity to understand neural networks in a much deeper and more direct way.","http://cur.at/Ujx9D8k?m=web","7"
"resources","Signals from Strata + Hadoop World New York 2014","Last week, experts from across the data world came together in New York City for Strata + Hadoop World. Here's a collection of notable keynotes, interviews, and insights from the event. For a larger selection of presentations and interviews, see the ","http://cur.at/dihi4wb?m=web","7"
"resources","All Businesses Stand to Benefit from Big Data","The U.S. Chamber of Commerce Foundation recently hosted leaders in data innovation to discuss how data is changing the way businesses operate. Their report, ","http://cur.at/PGST6X8?m=web","7"
"resources","Data Visualization with JavaScript","This online book provides a great overview of JavaScript techniques and various libraries for displaying data on the web.  This is well organized, with source code and demos.  This is definitely worth bookmarking.","http://cur.at/LYVioUD?m=web","7"
"viz","Linked Small Multiples","Linking Small Multiples can be a very effective way of visually exploring a large dataset.   Here’s a great tutorial about using this technique, along with demos, sample code, and lots of linked references.  There are lots of ideas here.  This is very well done.","http://cur.at/6aIZihL?m=web","7"
"viz","Data and sports: 10 must-follow blogs","This article is for all data enthusiasts.  If you’re interested in sports data, you’ll obviously be interested.  But if you’re not interested in sports data, you’ll want to check this article out anyway.  The sports world has lots of data and lots of resources; making this a worthwhile domain to watch for fresh ideas.","http://cur.at/qN7JgkH?m=web","7"
"news","The Next Data Goldmine: Paper","Data analysis is a runaway growth field these days - which is all fine and good when the data's digital to begin with. But what about when it's tied up in paper?","http://cur.at/Io07iXd?m=web","8"
"news","How quickly Ebola spreads compared to other diseases","Compared to other infectious diseases, the data shows that Ebola spreads slowly and to relatively few people. But it is extremely deadly.  This simulation shows how quickly 10 diseases, from more fatal to less fatal, spread from one person to 100 unvaccinated people.  This is a very effective data presentation.","http://cur.at/CGBu6qr?m=web","8"
"news","Google's Secretive DeepMind Start-up Unveils A ""Neural Turing Machine""","DeepMind has built a neural network that can access an external memory like a conventional Turing machine. The result is a computer that mimics the short-term memory of the human brain.  This article explains how it works.","http://cur.at/u3S8JoJ?m=web","8"
"news","8 Data Innovation Projects to Present at Collab/Space DC","Collab/Space DC will highlight innovation projects focused on open data, data journalism, government data and data visualizations.  Here are profiles of the top eight data innovation projects.","http://cur.at/1dvVfhp?m=web","8"
"techniques","Jerome Cukier - Slopes of San Francisco","Jerome Cukier is a data visualization master.  In this tutorial, he guides us through his approach to developing a practical map for walking in San Francisco.  From data extraction to final design, this is a very readable overview of his thinking process.","http://cur.at/bo2kNJc?m=web","8"
"resources","Data Sources for Cool Data Science Projects - Part 1","This is a nice collection of public data sources for data mining, data viz, data journalism, etc, etc.  This collection includes market, media, and government sources.","http://cur.at/EM2nc5X?m=web","8"
"resources","Data Sources for Cool Data Science Projects - Part 2 ","This second part of ","http://cur.at/GuPfLYB?m=web","8"
"viz","Intro to D3.js","Square created this D3 tutorial as an entry point for its new engineers.  This isn't a deep-dive but it's a very worthwhile introduction to D3.  With code samples, demos, and reference links, this is very well done.","http://cur.at/8mflkI7?m=web","8"
"viz","Ghostweather R&D Blog: A Roundup of Recent Text Analytics and Vis Work","This collection of recent text analysis and visualization resources is a must-read for anyone interested in text analysis.  Lynn Cherny, who put this collection together, is an expert in text-based analysis and she's very engaged in the data viz and analytics communities.","http://cur.at/nZKdnF0?m=web","8"
"viz","Text Visualization Browser","There's a lot of power in text analytics but it's a tricky domain to master.  This collection of text visualization techniques is very well organized and offers a lot of ideas with links to detailed resources.  This collection is a MUST check-out.","http://cur.at/Z3oAnb1?m=web","8"
"news","The Three Breakthroughs That Have Finally Unleashed AI on the World","The business plans of the next 10,000 startups are easy to forecast: Take X and add AI. This is a big deal, and it's here now.  This is an insightful article that also inspired a thought-provoking ","http://cur.at/B2mh6ox?m=web","9"
"news","Big Data: 25 Amazing Need-to-Know Facts","Fun facts with links to sources.  Guess how much data the NSA analyzes everyday.  Or how much data the world's largest single database holds. There's great Twitter material here!","http://cur.at/rtyLfUy?m=web","9"
"news","Big data: 8 ideas to watch","Nice article by Ben Lorica at O'Reilly Media about the major forces shaping today's data world.  It's a survey, not a deep dive, but there are lots of links throughout the article that guide further exploration.","http://cur.at/GTF51gP?m=web","9"
"news","DataKind - Tackling the world's biggest problems through data science","This is inspirational.  Launched in 2011, DataKind leads a global effort to use data science in the service of humanity. It's community-driven, with regular volunteer events throughout the world. The title link will take you to a good overview and if you're up for ","http://cur.at/FnPr107?m=web","9"
"news","Bright lights, big cities, bigger data - Four big data projects that are changing U.S. cities for the better","With sensors practically everywhere, cities have access to vast troves of information about themselves.  What they do with that information is not only interesting, this article provides insights into unmet needs.  Think you know what causes traffic congestion in Los Angeles?  You might be surprised what the data says.","http://cur.at/RqwoNPa?m=web","9"
